{
  "schema_version": 1,
  "cycle_id": "PLC-20260907-C1F01A84",
  "updated_at": "2026-09-07T11:49:38Z",
  "status": "complete",
  "stable_framework_ref": "69079018606750312344cb3c648952b9ab72d35b",
  "framework_candidate_ref": "07460985d9984dbcf3833e6142709c0965a05967",
  "source_project": {
    "repository": "lijust/EREI-App-Google"
  },
  "steps": {
    "capture": {
      "status": "completed",
      "repository": "lijust/EREI-App-Google",
      "ref": "4eeb8b6f4f4fb330c23b0a1ba5a0ed2c036f3b1e",
      "evidence": [
        "github-pr:78",
        "task:ETASK-20260907T022906Z-A57F01C2"
      ]
    },
    "review": {
      "status": "completed",
      "repository": "lijust/EREI-App-Google",
      "ref": "fdab1bc342f897521f1304e74ceb3737588a863e",
      "evidence": [
        "app-review:ELR-20260907T110207Z-C1A57F01",
        "github-pr:85"
      ]
    },
    "feedback": {
      "status": "completed",
      "repository": "lijust/EREI-App-Google",
      "ref": "a7d7e0fdfe3357973beb8256b1435162bb753a1e",
      "evidence": [
        "feedback:EFF-20260907T110336Z-C1F01A84",
        "github-pr:85"
      ]
    },
    "improvement": {
      "status": "completed",
      "repository": "lijust/EREI-Engineering-Framework",
      "ref": "07460985d9984dbcf3833e6142709c0965a05967",
      "evidence": [
        "framework-decision:EFD-20260907T110819Z-C1F01A84",
        "github-pr:33",
        "github-actions:34116080178",
        "github-actions:34116080202"
      ]
    },
    "adoption": {
      "status": "completed",
      "repository": "lijust/EREI-App-Google",
      "ref": "9f677504bafc3a2a8460f81b3b2088341a51a302",
      "evidence": [
        "github-pr:87",
        "task:ETASK-20260907T112848Z-C1AD0A87",
        "github-actions:34116935307",
        "github-actions:34116935280",
        "github-actions:34116935268",
        "github-actions:34116935109"
      ]
    },
    "measured_outcome": {
      "status": "completed",
      "repository": "lijust/EREI-App-Google",
      "ref": "9adf44b92f1994304ccfad5d3d553f967c1436df",
      "evidence": [
        "github-pr:88",
        "github-actions:34118146756",
        "app-merge:9adf44b92f1994304ccfad5d3d553f967c1436df",
        "github-pr:89",
        "github-actions:34118499862",
        "app-merge:5a90d0c05934341c79fb79740ae15edff049f167"
      ]
    }
  },
  "blockers": []
}
